{
  "methodology_version": "0.10.0",
  "generated_at": "2026-07-23T07:21:47.949041Z",
  "data_date": "2026-07-22",
  "source_citation": "Source: OpenRouter (openrouter.ai/rankings), as of 2026-07-22",
  "scope_note": "Estimated CO2 footprint of LLM-inference traffic visible through OpenRouter. NOT global data-center emissions. All figures are estimates with uncertainty.",
  "assumptions": {
    "input_output_ratio": "80:20",
    "pue_band": "1.1 / 1.25 / 1.56",
    "prefill_alpha": "0.1 / 0.2 / 0.3",
    "embodied_ratio_of_operational": "0.28 / 0.39 / 0.54",
    "water_l_per_kwh": "onsite 0.3/0.9/1.8 + offsite EWIF 2.0/3.14/4.35"
  },
  "sources": [
    {
      "id": "C-GRID-EUROPE-WEST-230",
      "title": "Ember Yearly Electricity Data",
      "publisher": "Ember",
      "url": "https://ember-energy.org",
      "version": "2024",
      "accessed": "2026-06-15"
    },
    {
      "id": "C-GRID-MEE-2022",
      "title": "2022年电力二氧化碳排放因子公告 (2024年第33号)",
      "publisher": "生态环境部 + 国家统计局 (MEE + NBS, China)",
      "url": "https://www.mee.gov.cn/xxgk2018/xxgk/xxgk01/202412/t20241226_1099413.html",
      "version": "2022 (published 2024-12-20)",
      "accessed": "2026-06-18"
    },
    {
      "id": "C-GRID-UNMAPPED-ANNUAL",
      "title": "Annual regional envelope for unmapped inference locations",
      "publisher": "LLM Carbon Index (derived from EPA, Ember and MEE+NBS factors)",
      "url": "https://github.com/wyl2607/llm-carbon-index/blob/main/data/grid/annual_factors.yaml",
      "version": "0.10.0",
      "accessed": "2026-09-30"
    },
    {
      "id": "E-CLASS-LARGE",
      "title": "AI Energy Score v2 + EcoLogits (30-100B synthesis)",
      "publisher": "Hugging Face / GenAI Impact",
      "url": "https://huggingface.co/spaces/AIEnergyScore",
      "version": "v2",
      "accessed": "2026-09-22"
    },
    {
      "id": "E-CLASS-SMALL",
      "title": "AI Energy Score v2 + EcoLogits (small-model synthesis)",
      "publisher": "Hugging Face / GenAI Impact",
      "url": "https://huggingface.co/spaces/AIEnergyScore",
      "version": "v2",
      "accessed": "2026-09-22"
    },
    {
      "id": "E-DEEPSEEK-V4-FLASH",
      "title": "AI Energy Score v2",
      "publisher": "Hugging Face / Salesforce / CMU",
      "url": "https://huggingface.co/spaces/AIEnergyScore",
      "version": "v2",
      "accessed": "2026-09-22"
    },
    {
      "id": "E-DEEPSEEK-V4-PRO",
      "title": "AI Energy Score v2",
      "publisher": "Hugging Face / Salesforce / CMU",
      "url": "https://huggingface.co/spaces/AIEnergyScore",
      "version": "v2",
      "accessed": "2026-09-22"
    },
    {
      "id": "E-MINIMAX-M3",
      "title": "AI Energy Score v2",
      "publisher": "Hugging Face / Salesforce / CMU",
      "url": "https://huggingface.co/spaces/AIEnergyScore",
      "version": "v2",
      "accessed": "2026-09-22"
    },
    {
      "id": "GRID-EIA-PJM-HOURLY",
      "title": "EIA Electricity Hourly Grid Monitor (RTO fuel-type data)",
      "publisher": "U.S. Energy Information Administration",
      "url": "https://api.eia.gov",
      "version": "v2",
      "accessed": "2026-06-18"
    }
  ],
  "models": [
    {
      "slug": "xiaomi/mimo-v2.5-20260422",
      "display_name": "Xiaomi MiMo V2.5",
      "origin": "CN",
      "open_or_closed": "open",
      "total_tokens": 1561906638445,
      "est_output_tokens": 312381327689,
      "wh_per_output_token": {
        "low": 0.002,
        "mid": 0.005,
        "high": 0.012
      },
      "energy_kwh": {
        "low": 874667.7175292001,
        "mid": 2811431.9492010004,
        "high": 8246867.050989599
      },
      "energy_source": "parameter_class_fallback",
      "energy_source_id": "E-CLASS-LARGE",
      "region": "cn-north",
      "carbon_intensity_gco2_kwh": 678.0,
      "grid_source": "annual_factor",
      "grid_source_id": "C-GRID-MEE-2022",
      "pue": 1.25,
      "co2_kg": {
        "low": 652327.1837332776,
        "mid": 2382688.576947848,
        "high": 8722546.342490679
      },
      "co2_kg_embodied": {
        "low": 182651.61144531774,
        "mid": 929248.5450096607,
        "high": 4710175.024944967
      },
      "co2_kg_total": {
        "low": 834978.7951785953,
        "mid": 3311937.1219575084,
        "high": 13432721.367435645
      },
      "renewable_match_pct": null,
      "co2_kg_market": {
        "low": 652327.1837332776,
        "mid": 2382688.576947848,
        "high": 8722546.342490679
      },
      "wue": 4.04,
      "water_liters": {
        "low": 2514669.6878964505,
        "mid": 14197731.343465053,
        "high": 63397790.45448254
      },
      "flags": [
        "FALLBACK_ENERGY_CLASS",
        "FALLBACK_GRID_ANNUAL",
        "FALLBACK_CAPABILITY",
        "LOW_CONFIDENCE_GAP"
      ],
      "energy_wh_per_mtok": {
        "low": 2000.0,
        "mid": 5000.0,
        "high": 12000.0
      },
      "capability_index": null,
      "capability_source_id": null,
      "on_frontier": false,
      "frontier_reference_slug": null,
      "rightsizing_gap_pct": null,
      "avoidable_co2_kg": null
    },
    {
      "slug": "deepseek/deepseek-v4-flash-20260423",
      "display_name": "DeepSeek V4 Flash",
      "origin": "CN",
      "open_or_closed": "open",
      "total_tokens": 913235097630,
      "est_output_tokens": 182647019526,
      "wh_per_output_token": {
        "low": 0.0015,
        "mid": 0.0035,
        "high": 0.008
      },
      "energy_kwh": {
        "low": 383558.7410046001,
        "mid": 1150676.2230138,
        "high": 3214587.5436575995
      },
      "energy_source": "ai_energy_score",
      "energy_source_id": "E-DEEPSEEK-V4-FLASH",
      "region": "cn-north",
      "carbon_intensity_gco2_kwh": 678.0,
      "grid_source": "annual_factor",
      "grid_source_id": "C-GRID-MEE-2022",
      "pue": 1.25,
      "co2_kg": {
        "low": 286058.10904123075,
        "mid": 975198.0990041954,
        "high": 3400004.9531757697
      },
      "co2_kg_embodied": {
        "low": 80096.27053154462,
        "mid": 380327.25861163624,
        "high": 1836002.6747149157
      },
      "co2_kg_total": {
        "low": 366154.3795727754,
        "mid": 1355525.3576158318,
        "high": 5236007.627890686
      },
      "renewable_match_pct": null,
      "co2_kg_market": {
        "low": 286058.10904123075,
        "mid": 975198.0990041954,
        "high": 3400004.9531757697
      },
      "wue": 4.04,
      "water_liters": {
        "low": 1102731.3803882252,
        "mid": 5810914.92621969,
        "high": 24712141.74186779
      },
      "flags": [
        "FALLBACK_GRID_ANNUAL"
      ],
      "energy_wh_per_mtok": {
        "low": 1500.0,
        "mid": 3500.0,
        "high": 8000.0
      },
      "capability_index": 40.0,
      "capability_source_id": "Q-AAII-V41",
      "on_frontier": false,
      "frontier_reference_slug": "minimax/minimax-m3-20260531",
      "rightsizing_gap_pct": {
        "low": 0.0,
        "mid": 0.5714285714285714,
        "high": 0.9
      },
      "avoidable_co2_kg": {
        "low": 0.0,
        "mid": 557256.0565738259,
        "high": 3060004.4578581927
      }
    },
    {
      "slug": "tencent/hy3-20260706",
      "display_name": "tencent/hy3-20260706",
      "origin": "OTHER",
      "open_or_closed": "closed",
      "total_tokens": 713187597726,
      "est_output_tokens": 142637519545,
      "wh_per_output_token": {
        "low": 0.002,
        "mid": 0.005,
        "high": 0.012
      },
      "energy_kwh": {
        "low": 399385.05472620006,
        "mid": 1283737.6759060002,
        "high": 3765630.5159916
      },
      "energy_source": "parameter_class_fallback",
      "energy_source_id": "E-CLASS-LARGE",
      "region": "default",
      "carbon_intensity_gco2_kwh": 400.0,
      "grid_source": "annual_factor",
      "grid_source_id": "C-GRID-UNMAPPED-ANNUAL",
      "pue": 1.25,
      "co2_kg": {
        "low": 99726.44816513217,
        "mid": 641868.8379530002,
        "high": 3982832.084153996
      },
      "co2_kg_embodied": {
        "low": 27923.40548623701,
        "mid": 250328.8468016701,
        "high": 2150729.325443158
      },
      "co2_kg_total": {
        "low": 127649.85365136918,
        "mid": 892197.6847546704,
        "high": 6133561.409597154
      },
      "renewable_match_pct": null,
      "co2_kg_market": {
        "low": 99726.44816513217,
        "mid": 641868.8379530002,
        "high": 3982832.084153996
      },
      "wue": 4.04,
      "water_liters": {
        "low": 1148232.032337825,
        "mid": 6482875.263325302,
        "high": 28948284.59168542
      },
      "flags": [
        "UNKNOWN_MODEL",
        "FALLBACK_ENERGY_CLASS",
        "UNMAPPED_SLUG",
        "ASSUMED_REGION",
        "FALLBACK_GRID_ANNUAL",
        "CLOSED_MODEL_ASSUMED",
        "FALLBACK_CAPABILITY",
        "LOW_CONFIDENCE_GAP"
      ],
      "carbon_intensity_gco2_kwh_range": {
        "low": 227.0,
        "mid": 400.0,
        "high": 678.0
      },
      "energy_wh_per_mtok": {
        "low": 2000.0,
        "mid": 5000.0,
        "high": 12000.0
      },
      "capability_index": null,
      "capability_source_id": null,
      "on_frontier": false,
      "frontier_reference_slug": null,
      "rightsizing_gap_pct": null,
      "avoidable_co2_kg": null
    },
    {
      "slug": "z-ai/glm-5.2-20260616",
      "display_name": "z-ai/glm-5.2-20260616",
      "origin": "OTHER",
      "open_or_closed": "closed",
      "total_tokens": 615673006629,
      "est_output_tokens": 123134601326,
      "wh_per_output_token": {
        "low": 0.002,
        "mid": 0.005,
        "high": 0.012
      },
      "energy_kwh": {
        "low": 344776.8837126,
        "mid": 1108211.4119330002,
        "high": 3250753.4750028
      },
      "energy_source": "parameter_class_fallback",
      "energy_source_id": "E-CLASS-LARGE",
      "region": "default",
      "carbon_intensity_gco2_kwh": 400.0,
      "grid_source": "annual_factor",